{
  "$schema": "https://json-schema.org/draft/2020-12/schema",
  "$id": "https://jocky.dev/schemas/v1/task-envelope.schema.json",
  "title": "TaskEnvelope",
  "description": "Validated controller-to-endpoint task contract. Defining this envelope does not implement task dispatch or execution.",
  "type": "object",
  "additionalProperties": false,
  "required": [
    "schema_version",
    "task_id",
    "case_id",
    "endpoint_id",
    "issued_at",
    "expires_at",
    "target",
    "package",
    "entrypoint",
    "parameters",
    "requested_capabilities",
    "execution_profile",
    "limits"
  ],
  "properties": {
    "schema_version": {
      "const": "1.0.0"
    },
    "task_id": {
      "type": "string",
      "format": "uuid",
      "pattern": "^[0-9a-fA-F]{8}-[0-9a-fA-F]{4}-[0-9a-fA-F]{4}-[0-9a-fA-F]{4}-[0-9a-fA-F]{12}$"
    },
    "case_id": {
      "type": "string",
      "format": "uuid",
      "pattern": "^[0-9a-fA-F]{8}-[0-9a-fA-F]{4}-[0-9a-fA-F]{4}-[0-9a-fA-F]{4}-[0-9a-fA-F]{12}$"
    },
    "endpoint_id": {
      "type": "string",
      "format": "uuid",
      "pattern": "^[0-9a-fA-F]{8}-[0-9a-fA-F]{4}-[0-9a-fA-F]{4}-[0-9a-fA-F]{4}-[0-9a-fA-F]{12}$"
    },
    "issued_at": {
      "type": "string",
      "format": "date-time",
      "pattern": "^\\d{4}-\\d{2}-\\d{2}T\\d{2}:\\d{2}:\\d{2}(?:\\.\\d+)?Z$"
    },
    "expires_at": {
      "type": "string",
      "format": "date-time",
      "pattern": "^\\d{4}-\\d{2}-\\d{2}T\\d{2}:\\d{2}:\\d{2}(?:\\.\\d+)?Z$"
    },
    "target": {
      "type": "object",
      "additionalProperties": false,
      "required": ["platform", "architecture"],
      "properties": {
        "platform": {
          "type": "string",
          "enum": ["windows", "ubuntu"]
        },
        "architecture": {
          "type": "string",
          "enum": ["x86_64", "aarch64"]
        }
      }
    },
    "package": {
      "type": "object",
      "additionalProperties": false,
      "required": ["package_id", "build_id", "version", "sha256"],
      "properties": {
        "package_id": {
          "type": "string",
          "format": "uuid",
          "pattern": "^[0-9a-fA-F]{8}-[0-9a-fA-F]{4}-[0-9a-fA-F]{4}-[0-9a-fA-F]{4}-[0-9a-fA-F]{12}$"
        },
        "build_id": {
          "type": "string",
          "format": "uuid",
          "pattern": "^[0-9a-fA-F]{8}-[0-9a-fA-F]{4}-[0-9a-fA-F]{4}-[0-9a-fA-F]{4}-[0-9a-fA-F]{12}$"
        },
        "version": {
          "type": "string",
          "minLength": 1,
          "maxLength": 64
        },
        "sha256": {
          "type": "string",
          "pattern": "^[a-f0-9]{64}$"
        }
      }
    },
    "entrypoint": {
      "type": "string",
      "pattern": "^[A-Za-z_][A-Za-z0-9_.]*$",
      "maxLength": 255
    },
    "parameters": {
      "type": "object",
      "maxProperties": 64
    },
    "requested_capabilities": {
      "type": "array",
      "minItems": 1,
      "uniqueItems": true,
      "items": {
        "type": "string",
        "enum": [
          "system",
          "processes",
          "network",
          "files",
          "events",
          "persistence",
          "drivers",
          "indicators"
        ]
      }
    },
    "execution_profile": {
      "type": "string",
      "enum": ["standard", "lab_only"]
    },
    "limits": {
      "type": "object",
      "additionalProperties": false,
      "required": ["timeout_seconds", "max_output_bytes"],
      "properties": {
        "timeout_seconds": {
          "type": "integer",
          "minimum": 1,
          "maximum": 86400
        },
        "max_output_bytes": {
          "type": "integer",
          "minimum": 1,
          "maximum": 1073741824
        }
      }
    }
  }
}

