{
  "schema_version": "1.0.0",
  "task_id": "22222222-2222-4222-8222-222222222222",
  "case_id": "aaaaaaaa-aaaa-4aaa-8aaa-aaaaaaaaaaaa",
  "endpoint_id": "11111111-1111-4111-8111-111111111111",
  "issued_at": "2026-08-30T12:00:00Z",
  "expires_at": "2026-08-30T12:30:00Z",
  "target": {
    "platform": "ubuntu",
    "architecture": "x86_64"
  },
  "package": {
    "package_id": "77777777-7777-4777-8777-777777777777",
    "build_id": "66666666-6666-4666-8666-666666666666",
    "version": "0.0.0-fixture",
    "sha256": "aaaaaaaaaaaaaaaaaaaaaaaaaaaaaaaaaaaaaaaaaaaaaaaaaaaaaaaaaaaaaaaa"
  },
  "entrypoint": "triage.investigate",
  "parameters": {
    "include_network_metadata": true
  },
  "requested_capabilities": ["system", "network"],
  "execution_profile": "standard",
  "limits": {
    "timeout_seconds": 300,
    "max_output_bytes": 1048576
  }
}

